{
  "schemaVersion": 1,
  "applicationId": "sirk-portal",
  "displayName": "SIRK Portal",
  "serviceName": "sirkportal.exe",
  "watchdogServiceName": "sirkportalwatchdog.exe",
  "installRoot": "C:\\Program Files\\SIRK\\Portal",
  "dataRoot": "C:\\ProgramData\\SIRK\\Portal",
  "healthUrl": "https://127.0.0.1/login",
  "channel": "dev",
  "updateSource": "https://github.com/Eris92/SIRK-Portal",
  "signatureRequired": false
}
